{
  "v": 1,
  "label": "an edit settling a conflict by a rule of the engine's is refused while the diverging body is unread",
  "note": "the case of 100 with b's diverging body not fetched yet: b's conflict at w2 holds no conflict_object. An overruling Edit would adopt an unknown body into the base and push c2 over a body nobody read, which no rule may choose against (SYNC.md §9), and there is nothing to keep. It is refused and stages nothing; the upgrade fetches the body first (SYNC.md §6) and the settle is then 100 (SYNC.md §7)",
  "store": {
    "collections": [{ "id": "Contacts", "account": null, "kind": "text/vcard", "conflict": "manual" }],
    "objects": { "c1": { "body": "fixtures/card-basic.vcf" }, "c2": { "body": "fixtures/card-basic-edited.vcf" } },
    "items": [{ "collection": "Contacts", "link_id": "urn:uuid:4fbe8971-0bc3-4e1f-8a2d-1c9b7f6e5d40", "seq": 1, "flags": [], "object": "c2", "level": 2, "deleted": 0 }],
    "bindings": [
      { "collection": "Contacts", "link_id": "urn:uuid:4fbe8971-0bc3-4e1f-8a2d-1c9b7f6e5d40", "source": "a", "handle": "a.vcf", "base_flags": [], "base_object": "c2", "base_revision": "v2", "base_present": 1, "shared_object": "c2" },
      { "collection": "Contacts", "link_id": "urn:uuid:4fbe8971-0bc3-4e1f-8a2d-1c9b7f6e5d40", "source": "b", "handle": "b.vcf", "base_flags": [], "base_object": "c1", "base_revision": "w1", "base_present": 1, "conflicted": 1, "conflict_revision": "w2", "conflict_object": null, "shared_object": "c1" }
    ],
    "sources": [
      { "collection": "Contacts", "source": "a", "checkpoint": "a1" },
      { "collection": "Contacts", "source": "b", "checkpoint": "b1" }
    ]
  },
  "run": { "verb": "mutate", "collection": "Contacts", "source": "b", "mutation": { "kind": "Edit", "seq": 1, "object": "c2", "if_match": "c2", "overrule": true } },
  "remote": {
    "snapshot": null,
    "fetch": {}
  },
  "expect": {
    "pushes": [],
    "outcomes": [],
    "events": [],
    "failed": true,
    "store": {
      "items": [{ "collection": "Contacts", "link_id": "urn:uuid:4fbe8971-0bc3-4e1f-8a2d-1c9b7f6e5d40", "seq": 1, "flags": [], "object": "c2", "level": 2, "deleted": 0, "conflicted": 0, "conflict_object": null }],
      "bindings": [
        { "collection": "Contacts", "link_id": "urn:uuid:4fbe8971-0bc3-4e1f-8a2d-1c9b7f6e5d40", "source": "a", "handle": "a.vcf", "base_flags": [], "base_object": "c2", "base_revision": "v2", "base_present": 1, "shared_object": "c2" },
        { "collection": "Contacts", "link_id": "urn:uuid:4fbe8971-0bc3-4e1f-8a2d-1c9b7f6e5d40", "source": "b", "handle": "b.vcf", "base_flags": [], "base_object": "c1", "base_revision": "w1", "base_present": 1, "conflicted": 1, "conflict_revision": "w2", "conflict_object": null, "shared_object": "c1" }
      ],
      "sources": [
        { "collection": "Contacts", "source": "a", "checkpoint": "a1" },
        { "collection": "Contacts", "source": "b", "checkpoint": "b1" }
      ]
    }
  }
}
