{
  "v": 1,
  "label": "a source's new body meeting an item another source's pull emptied is a divergence, never dropped",
  "note": "the store 80 left: a pulled an edit it has not read, the item holds no body. b's upgrade fetches c3 at s2, an edit b's server made meanwhile. b changed (c3 against its base c1), the item changed for b (it holds no body where b agreed c1, so its body is one nobody read), and the two disagree: under manual the shared body stays absent, the item is flagged and c3 is recorded as its conflict_object. Dropping c3, or adopting it, would let a's unread edit or b's be pushed over the other. b's shared_object stays c1: an upsert leaving the item conflicted moves none (SYNC.md §9)",
  "store": {
    "collections": [{ "id": "Contacts", "account": null, "kind": "text/vcard", "conflict": "manual" }],
    "objects": { "c1": { "body": "fixtures/card-basic.vcf" }, "c2": { "body": "fixtures/card-basic-edited.vcf" }, "c3": { "body": "fixtures/card-basic-renamed.vcf" } },
    "items": [{ "collection": "Contacts", "link_id": "urn:uuid:4fbe8971-0bc3-4e1f-8a2d-1c9b7f6e5d40", "seq": 1, "flags": [], "object": null, "level": 1, "deleted": 0 }],
    "bindings": [
      { "collection": "Contacts", "link_id": "urn:uuid:4fbe8971-0bc3-4e1f-8a2d-1c9b7f6e5d40", "source": "a", "handle": "a.vcf", "base_flags": [], "base_object": null, "base_revision": "r2", "base_present": 1, "shared_object": "c1" },
      { "collection": "Contacts", "link_id": "urn:uuid:4fbe8971-0bc3-4e1f-8a2d-1c9b7f6e5d40", "source": "b", "handle": "b.vcf", "base_flags": [], "base_object": "c1", "base_revision": "s1", "base_present": 1, "shared_object": "c1" }
    ],
    "sources": [
      { "collection": "Contacts", "source": "a", "checkpoint": "a2" },
      { "collection": "Contacts", "source": "b", "checkpoint": "b1" }
    ]
  },
  "run": { "verb": "upgrade", "collection": "Contacts", "source": "b", "tier": "Full", "handles": ["b.vcf"] },
  "remote": {
    "snapshot": null,
    "fetch": { "b.vcf": { "Full": { "body": "fixtures/card-basic-renamed.vcf", "revision": "s2" } } }
  },
  "expect": {
    "pushes": [],
    "outcomes": [],
    "events": [],
    "store": {
      "items": [{ "collection": "Contacts", "link_id": "urn:uuid:4fbe8971-0bc3-4e1f-8a2d-1c9b7f6e5d40", "seq": 1, "flags": [], "object": null, "level": 1, "deleted": 0, "conflicted": 1, "conflict_object": "c3" }],
      "bindings": [
        { "collection": "Contacts", "link_id": "urn:uuid:4fbe8971-0bc3-4e1f-8a2d-1c9b7f6e5d40", "source": "a", "handle": "a.vcf", "base_flags": [], "base_object": null, "base_revision": "r2", "base_present": 1, "shared_object": "c1" },
        { "collection": "Contacts", "link_id": "urn:uuid:4fbe8971-0bc3-4e1f-8a2d-1c9b7f6e5d40", "source": "b", "handle": "b.vcf", "base_flags": [], "base_object": "c3", "base_revision": "s2", "base_present": 1, "shared_object": "c1" }
      ],
      "sources": [
        { "collection": "Contacts", "source": "a", "checkpoint": "a2" },
        { "collection": "Contacts", "source": "b", "checkpoint": "b1" }
      ]
    }
  }
}
