{
  "v": 1,
  "label": "two members stating no Message-ID with one alt: fallback are two items, the second minted",
  "note": "both members' meta derive the same alt: key from subject, date and sender; the fallback goes through the free and minted branches like a hint, decided from the handles in byte order, so 30 takes the bare key and 31 the minted one, each with its own seq (STORAGE §9, SYNC.md §6). attachment is 0 without the body, no Content-Type being text/plain",
  "store": {
    "collections": [{ "id": "INBOX", "account": null, "kind": "message/rfc822", "conflict": "manual" }],
    "objects": {},
    "items": [],
    "bindings": [],
    "sources": [{ "collection": "INBOX", "source": "imap", "checkpoint": "c1" }]
  },
  "run": {
    "verb": "sync",
    "collection": "INBOX",
    "source": "imap",
    "options": {
      "push": true,
      "rights": { "flags": true, "content": true, "add": true, "remove": true },
      "conflict": "manual"
    }
  },
  "remote": {
    "snapshot": {
      "items": [
        { "handle": "30", "flags": [], "revision": null, "meta": { "body": "fixtures/mail-no-message-id.eml" } },
        { "handle": "31", "flags": [], "revision": null, "meta": { "body": "fixtures/mail-no-message-id.eml" } }
      ],
      "vanished": [],
      "complete": true,
      "checkpoint": "c2"
    },
    "fetch": {}
  },
  "expect": {
    "pushes": [],
    "outcomes": [],
    "events": [
      { "kind": "Added", "handle": "30" },
      { "kind": "Added", "handle": "31" }
    ],
    "store": {
      "items": [
        { "collection": "INBOX", "link_id": "alt:Cron alert|2026-08-01T10:00:00Z|cron@example.org", "seq": 1, "flags": [], "object": null, "level": 1, "deleted": 0, "sort_key": "2026-08-01T10:00:00Z" },
        { "collection": "INBOX", "link_id": "dup:alt:Cron alert|2026-08-01T10:00:00Z|cron@example.org#31", "seq": 2, "flags": [], "object": null, "level": 1, "deleted": 0, "sort_key": "2026-08-01T10:00:00Z" }
      ],
      "bindings": [
        { "collection": "INBOX", "link_id": "alt:Cron alert|2026-08-01T10:00:00Z|cron@example.org", "source": "imap", "handle": "30", "base_flags": [], "base_object": null, "base_revision": null, "base_present": 1, "round": 1 },
        { "collection": "INBOX", "link_id": "dup:alt:Cron alert|2026-08-01T10:00:00Z|cron@example.org#31", "source": "imap", "handle": "31", "base_flags": [], "base_object": null, "base_revision": null, "base_present": 1, "round": 1 }
      ],
      "summaries": [
        { "table": "mail_summary", "collection": "INBOX", "link_id": "alt:Cron alert|2026-08-01T10:00:00Z|cron@example.org", "row": { "message_id": null, "in_reply_to": [], "subject": "Cron alert", "sender": "cron@example.org", "sender_name": "Cron Daemon", "date": "2026-08-01T10:00:00Z", "size": 141, "attachment": 0, "invitation": null } },
        { "table": "mail_summary", "collection": "INBOX", "link_id": "dup:alt:Cron alert|2026-08-01T10:00:00Z|cron@example.org#31", "row": { "message_id": null, "in_reply_to": [], "subject": "Cron alert", "sender": "cron@example.org", "sender_name": "Cron Daemon", "date": "2026-08-01T10:00:00Z", "size": 141, "attachment": 0, "invitation": null } }
      ],
      "addresses": [
        { "collection": "INBOX", "link_id": "alt:Cron alert|2026-08-01T10:00:00Z|cron@example.org", "role": "from", "position": 0, "address": "cron@example.org", "name": "Cron Daemon" },
        { "collection": "INBOX", "link_id": "alt:Cron alert|2026-08-01T10:00:00Z|cron@example.org", "role": "to", "position": 0, "address": "ops@example.org", "name": null },
        { "collection": "INBOX", "link_id": "dup:alt:Cron alert|2026-08-01T10:00:00Z|cron@example.org#31", "role": "from", "position": 0, "address": "cron@example.org", "name": "Cron Daemon" },
        { "collection": "INBOX", "link_id": "dup:alt:Cron alert|2026-08-01T10:00:00Z|cron@example.org#31", "role": "to", "position": 0, "address": "ops@example.org", "name": null }
      ],
      "sources": [{ "collection": "INBOX", "source": "imap", "checkpoint": "c2" }]
    }
  }
}
