{
  "v": 1,
  "label": "prefer-existing keeps the shared body and the diverging one it refused as a retained item",
  "note": "the case of 85 under prefer-existing: the item keeps c3, and c2, the body b brought and the policy refused, is kept as a retained item under the key minted over b's handle and reported Overruled. b's base is c2 at r2, so it owes c3 and pushes it on its next sync (SYNC.md §9; STORAGE §11)",
  "store": {
    "collections": [{ "id": "Contacts", "account": null, "kind": "text/vcard", "conflict": "prefer-existing" }],
    "objects": { "c1": { "body": "fixtures/card-basic.vcf" }, "c2": { "body": "fixtures/card-basic-edited.vcf" }, "c3": { "body": "fixtures/card-basic-renamed.vcf" } },
    "items": [{ "collection": "Contacts", "link_id": "urn:uuid:4fbe8971-0bc3-4e1f-8a2d-1c9b7f6e5d40", "seq": 1, "flags": [], "object": "c3", "level": 2, "deleted": 0 }],
    "bindings": [
      { "collection": "Contacts", "link_id": "urn:uuid:4fbe8971-0bc3-4e1f-8a2d-1c9b7f6e5d40", "source": "a", "handle": "a.vcf", "base_flags": [], "base_object": "c1", "base_revision": "r1", "base_present": 1, "shared_object": "c3" },
      { "collection": "Contacts", "link_id": "urn:uuid:4fbe8971-0bc3-4e1f-8a2d-1c9b7f6e5d40", "source": "b", "handle": "b.vcf", "base_flags": [], "base_object": "c1", "base_revision": "r1", "base_present": 1, "conflicted": 1, "conflict_revision": "r2", "conflict_object": "c2", "shared_object": "c1" }
    ],
    "sources": [
      { "collection": "Contacts", "source": "a", "checkpoint": "a1" },
      { "collection": "Contacts", "source": "b", "checkpoint": "b1" }
    ]
  },
  "run": { "verb": "mutate", "collection": "Contacts", "source": "b", "mutation": { "kind": "Edit", "seq": 1, "object": "c2" } },
  "remote": {
    "snapshot": null,
    "fetch": {}
  },
  "expect": {
    "pushes": [],
    "outcomes": [],
    "events": [{ "kind": "Overruled", "handle": "b.vcf", "link_id": "dup:urn:uuid:4fbe8971-0bc3-4e1f-8a2d-1c9b7f6e5d40#b.vcf" }],
    "store": {
      "items": [
        { "collection": "Contacts", "link_id": "urn:uuid:4fbe8971-0bc3-4e1f-8a2d-1c9b7f6e5d40", "seq": 1, "flags": [], "object": "c3", "level": 2, "deleted": 0, "conflicted": 0, "conflict_object": null },
        { "collection": "Contacts", "link_id": "dup:urn:uuid:4fbe8971-0bc3-4e1f-8a2d-1c9b7f6e5d40#b.vcf", "seq": 2, "flags": [], "object": "c2", "level": 2, "deleted": 1, "retained": true, "retained_by": "b" }
      ],
      "bindings": [
        { "collection": "Contacts", "link_id": "urn:uuid:4fbe8971-0bc3-4e1f-8a2d-1c9b7f6e5d40", "source": "a", "handle": "a.vcf", "base_flags": [], "base_object": "c1", "base_revision": "r1", "base_present": 1, "shared_object": "c3" },
        { "collection": "Contacts", "link_id": "urn:uuid:4fbe8971-0bc3-4e1f-8a2d-1c9b7f6e5d40", "source": "b", "handle": "b.vcf", "base_flags": [], "base_object": "c2", "base_revision": "r2", "base_present": 1, "shared_object": "c3" }
      ],
      "sources": [
        { "collection": "Contacts", "source": "a", "checkpoint": "a1" },
        { "collection": "Contacts", "source": "b", "checkpoint": "b1" }
      ]
    }
  }
}
