{
  "v": 1,
  "label": "a server edit landing while the item is conflicted marks the binding conflicted, whatever the source's policy",
  "note": "the item diverged between a and b under manual (vector 28) and every binding projects Conflict with no revision. b's server then edits the member, and a delta lists it once at r3, past b's base r2. The item's conflict is still open, so prefer-remote neither pulls nor drops anything: the binding records r3 and asks for the diverging body, beside the item's conflict and not into it; without this the edit is skipped and never listed again (SYNC.md §5, §9)",
  "store": {
    "collections": [{ "id": "Contacts", "account": null, "kind": "text/vcard", "conflict": "manual" }],
    "objects": {
      "c1": { "body": "fixtures/card-basic.vcf" },
      "c2": { "body": "fixtures/card-basic-edited.vcf" },
      "c3": { "body": "fixtures/card-basic-renamed.vcf" }
    },
    "items": [{ "collection": "Contacts", "link_id": "urn:uuid:4fbe8971-0bc3-4e1f-8a2d-1c9b7f6e5d40", "seq": 1, "flags": [], "object": "c3", "level": 2, "deleted": 0, "conflicted": 1, "conflict_object": "c2" }],
    "bindings": [
      { "collection": "Contacts", "link_id": "urn:uuid:4fbe8971-0bc3-4e1f-8a2d-1c9b7f6e5d40", "source": "a", "handle": "a.vcf", "base_flags": [], "base_object": "c1", "base_revision": "r1", "base_present": 1, "conflicted": 0, "conflict_revision": null, "conflict_object": null, "shared_object": "c3" },
      { "collection": "Contacts", "link_id": "urn:uuid:4fbe8971-0bc3-4e1f-8a2d-1c9b7f6e5d40", "source": "b", "handle": "b.vcf", "base_flags": [], "base_object": "c2", "base_revision": "r2", "base_present": 1, "shared_object": "c1" }
    ],
    "sources": [{ "collection": "Contacts", "source": "a", "checkpoint": "a1" }, { "collection": "Contacts", "source": "b", "checkpoint": "b1" }]
  },
  "run": {
    "verb": "sync",
    "collection": "Contacts",
    "source": "b",
    "options": {
      "push": true,
      "rights": { "flags": true, "content": true, "add": true, "remove": true },
      "conflict": "prefer-remote"
    }
  },
  "remote": {
    "snapshot": {
      "items": [{ "handle": "b.vcf", "flags": [], "revision": "r3", "meta": { "body": "fixtures/card-basic-edited.vcf" } }],
      "vanished": [],
      "complete": false,
      "checkpoint": "b2"
    },
    "fetch": {}
  },
  "expect": {
    "pushes": [],
    "outcomes": [],
    "events": [{ "kind": "Conflicted", "handle": "b.vcf" }],
    "store": {
      "items": [{ "collection": "Contacts", "link_id": "urn:uuid:4fbe8971-0bc3-4e1f-8a2d-1c9b7f6e5d40", "seq": 1, "flags": [], "object": "c3", "level": 2, "deleted": 0, "conflicted": 1, "conflict_object": "c2" }],
      "bindings": [
        { "collection": "Contacts", "link_id": "urn:uuid:4fbe8971-0bc3-4e1f-8a2d-1c9b7f6e5d40", "source": "a", "handle": "a.vcf", "base_flags": [], "base_object": "c1", "base_revision": "r1", "base_present": 1, "conflicted": 0, "conflict_revision": null, "conflict_object": null, "shared_object": "c3" },
        { "collection": "Contacts", "link_id": "urn:uuid:4fbe8971-0bc3-4e1f-8a2d-1c9b7f6e5d40", "source": "b", "handle": "b.vcf", "base_flags": [], "base_object": "c2", "base_revision": "r2", "base_present": 1, "conflicted": 1, "conflict_revision": "r3", "conflict_object": null, "shared_object": "c1" }
      ],
      "sources": [{ "collection": "Contacts", "source": "a", "checkpoint": "a1" }, { "collection": "Contacts", "source": "b", "checkpoint": "b2" }]
    }
  }
}
