{
  "v": 1,
  "label": "a pull carrying no body over another source's edit is recorded as a conflict, whatever the policy",
  "note": "b folded its edit c3 into the item; a still holds c1 and owes the push. a's server edits the card meanwhile and a's listing carries no body. Under prefer-remote a's own axis drops the local body and pulls, but nothing has read a's new body, so the write cannot let it replace c3: the item keeps c3 and is flagged with no conflict_object yet, the upgrade fetching a's body into it (vector 84), and no push carries c3 over a's unread edit. a's shared_object stays c1 (SYNC.md §5, §9)",
  "store": {
    "collections": [{ "id": "Contacts", "account": null, "kind": "text/vcard", "conflict": "manual" }],
    "objects": { "c1": { "body": "fixtures/card-basic.vcf" }, "c2": { "body": "fixtures/card-basic-edited.vcf" }, "c3": { "body": "fixtures/card-basic-renamed.vcf" } },
    "items": [{ "collection": "Contacts", "link_id": "urn:uuid:4fbe8971-0bc3-4e1f-8a2d-1c9b7f6e5d40", "seq": 1, "flags": [], "object": "c3", "level": 2, "deleted": 0 }],
    "bindings": [
      { "collection": "Contacts", "link_id": "urn:uuid:4fbe8971-0bc3-4e1f-8a2d-1c9b7f6e5d40", "source": "a", "handle": "a.vcf", "base_flags": [], "base_object": "c1", "base_revision": "r1", "base_present": 1, "shared_object": "c1" },
      { "collection": "Contacts", "link_id": "urn:uuid:4fbe8971-0bc3-4e1f-8a2d-1c9b7f6e5d40", "source": "b", "handle": "b.vcf", "base_flags": [], "base_object": "c3", "base_revision": "s2", "base_present": 1, "shared_object": "c3" }
    ],
    "sources": [
      { "collection": "Contacts", "source": "a", "checkpoint": "a1" },
      { "collection": "Contacts", "source": "b", "checkpoint": "b1" }
    ]
  },
  "run": { "verb": "sync", "collection": "Contacts", "source": "a", "options": { "push": true, "rights": { "flags": true, "content": true, "add": true, "remove": true }, "conflict": "prefer-remote" } },
  "remote": {
    "snapshot": {
      "items": [{ "handle": "a.vcf", "flags": [], "revision": "r2", "meta": { "body": "fixtures/card-basic-edited.vcf" } }],
      "vanished": [],
      "complete": true,
      "checkpoint": "a2"
    },
    "fetch": {}
  },
  "expect": {
    "pushes": [],
    "outcomes": [],
    "events": [{ "kind": "Conflicted", "handle": "a.vcf" }],
    "store": {
      "items": [{ "collection": "Contacts", "link_id": "urn:uuid:4fbe8971-0bc3-4e1f-8a2d-1c9b7f6e5d40", "seq": 1, "flags": [], "object": "c3", "level": 2, "deleted": 0, "conflicted": 1, "conflict_object": null }],
      "bindings": [
        { "collection": "Contacts", "link_id": "urn:uuid:4fbe8971-0bc3-4e1f-8a2d-1c9b7f6e5d40", "source": "a", "handle": "a.vcf", "base_flags": [], "base_object": null, "base_revision": "r2", "base_present": 1, "shared_object": "c1" },
        { "collection": "Contacts", "link_id": "urn:uuid:4fbe8971-0bc3-4e1f-8a2d-1c9b7f6e5d40", "source": "b", "handle": "b.vcf", "base_flags": [], "base_object": "c3", "base_revision": "s2", "base_present": 1, "shared_object": "c3" }
      ],
      "sources": [
        { "collection": "Contacts", "source": "a", "checkpoint": "a2" },
        { "collection": "Contacts", "source": "b", "checkpoint": "b1" }
      ]
    }
  }
}
